{"$schema":"https://json-schema.org/draft/2020-12/schema","$id":"https://chatgpt-lib.local/commands/edit_viewing_feedback.schema.json","type":"object","additionalProperties":false,"required":["schema_version","operation_id","operation","work_ref","target_edits"],"properties":{"schema_version":{"const":1},"operation_id":{"type":"string","minLength":36,"maxLength":36},"operation":{"const":"edit_viewing_feedback"},"work_ref":{"$ref":"https://chatgpt-lib.local/commands/common.schema.json#/$defs/workRef"},"target_edits":{"type":"array","minItems":1,"items":{"type":"object","additionalProperties":false,"required":["target"],"anyOf":[{"required":["set"]},{"required":["clear"]},{"required":["purge"]}],"properties":{"target":{"type":"string","minLength":1},"set":{"type":"object","additionalProperties":false,"minProperties":1,"properties":{"viewing":{"$ref":"https://chatgpt-lib.local/commands/common.schema.json#/$defs/viewing"},"rating":{"$ref":"https://chatgpt-lib.local/commands/common.schema.json#/$defs/rating"},"reaction":{"$ref":"https://chatgpt-lib.local/commands/common.schema.json#/$defs/reaction"},"feedback":{"$ref":"https://chatgpt-lib.local/commands/common.schema.json#/$defs/feedback"}}},"clear":{"type":"array","minItems":1,"uniqueItems":true,"items":{"enum":["viewing","rating","reaction","feedback"]}},"purge":{"type":"boolean","default":false}}}}}}
